社名,本社所在地,設立,転職エージェント数,職業紹介許可番号,紹介事業許可年,ホームページ,注力職種,注力エリア
アイアルマーズ株式会社,〒108-0071 東京都港区白金台3-19-6白金台ビル4階,2006年,4名,登録なし,2014年,http://www.i-arumas.jp/,営業 / 管理・事務 / 建築・土木,関東 / 北海道・東北
株式会社IODキャリア,〒100-0005 東京都千代田区丸の内一丁目8番3号　丸の内トラストタワー本館5階,1998年12月,登録なし,登録なし,平成21年05月01,https://www.iod-career.co.jp/,営業 / 医療・福祉 / WEB・インターネット・ゲーム / ITエンジニア / 電気・電子・機械・半導体 / 医薬・食品・化学・素材,関東 / 関西 / 東海
株式会社アイコニックジャパン,〒104-0041 東京都中央区新富２丁目４番５号 ニュー新富ビル４F 東京メトロ新富町駅　徒歩1分,平成24年4月,登録なし,登録なし,平成24年,https://iconicjob.jp/,営業 / 企画・経営 / 管理・事務 / コンサルタント・金融・不動産専門職 / ITエンジニア,登録なし
合同会社IJT,〒232-0071 神奈川県横浜市南区永田北3―28,2017年8月,5名,登録なし,2017年11月,https://www.kaigo-village.com/,医療・福祉,関東
株式会社アイソリューション,〒103-0014 東京都中央区日本橋蛎殻町１－１８－２ 中野オイスタービル５F,2013年4月,登録なし,登録なし,2014年,http://isolution.co.jp/,建築・土木 / 営業 / 企画・経営 / 管理・事務 / 販売・フード・アミューズメント / 医療・福祉 / コンサルタント・金融・不動産専門職 / 技能工・設備・倉庫・農林水産・他,関東 / 関西 / 東海
株式会社アイティジェイ（EXA Bridge）,〒110-0015 東京都台東区東上野5-1-8 上野富士ビル3F,1995年4月20日,登録なし,登録なし,2013年5月1日,http://exa-bridge.com/,企画・経営 / 営業 / 管理・事務 / 販売・フード・アミューズメント / コンサルタント・金融・不動産専門職 / WEB・インターネット・ゲーム / ITエンジニア,関東 / 関西 / 東海 / 九州
株式会社アイデム,〒160-0022 東京都新宿区新宿1-4-10　アイデム本社ビル,1971年2月,30名,登録なし,2010年7月,http://smartagent.jp,営業,登録なし
株式会社アイデム　キャリアエージェント西日本,〒550-0005 大阪府大阪市西区西本町1-13-43 アイデム西本町ビル,1971年2月,10名,登録なし,2010年7月1日,http://smartagent.jp,営業 / 企画・経営 / 管理・事務 / 販売・フード・アミューズメント / 保育・教育・通訳 / コンサルタント・金融・不動産専門職 / クリエイティブ / WEB・インターネット・ゲーム / ITエンジニア,関西
株式会社アイデンティティー,〒150-0036 東京都渋谷区南平台町15-13　帝都渋谷ビル8階,2008年8月,8名,登録なし,2012年,http://id-entity.jp,ITエンジニア / クリエイティブ / WEB・インターネット・ゲーム,関東
株式会社アイ・ヒューマンサーチ,〒103-0022 東京都中央区日本橋室町４−６−２ 菱華ビル7階,2007年1月,登録なし,登録なし,２００７年,http://www.i-humans.co.jp/,管理・事務 / 営業 / ITエンジニア,登録なし
IPCM株式会社,〒130-0021 東京都墨田区緑1-2-10,平成24年11月1日,登録なし,登録なし,平成29年3月1日,登録なし,営業 / 管理・事務 / 販売・フード・アミューズメント / 美容・ホテル・ブライダル・交通 / WEB・インターネット・ゲーム / ITエンジニア,関東
株式会社アカネエージェンシー,〒110-0015 東京都台東区東上野2-1-13 東上野センタービル3階,昭和53年12月26日,2名,登録なし,平成29年6月1日,http://www.akane.co.jp,ITエンジニア / 営業 / 企画・経営 / 管理・事務 / 販売・フード・アミューズメント / 美容・ホテル・ブライダル・交通 / 医療・福祉 / クリエイティブ / WEB・インターネット・ゲーム / 建築・土木 / 医薬・食品・化学・素材 / 技能工・設備・倉庫・農林水産・他,関東 / 北海道・東北 / 東海
アクシードキャリア株式会社,〒102-0093 東京都千代田区平河町1丁目6番15号USビル6階,2017年6月,登録なし,登録なし,2017年10月,登録なし,営業 / 企画・経営 / 管理・事務,登録なし
株式会社アクセス２２,〒540-0026 大阪府大阪市中央区内本町１丁目３‐６　アティックビル３階,1990年11月2日,4名,登録なし,平成13年06月01,http://www.access22.co.jp/,建築・土木,関西 / 北海道・東北 / 北信越 / 関東 / 東海 / 中国・四国 / 九州
株式会社アクティブアンドカンパニー,〒102-0074 東京都千代田区九段南3-8-11 飛栄九段ビル5階,2006年1月5日,登録なし,登録なし,2006年,http://www.aand.co.jp/,営業 / 企画・経営 / 管理・事務 / 保育・教育・通訳 / コンサルタント・金融・不動産専門職 / クリエイティブ / WEB・インターネット・ゲーム / ITエンジニア,関東 / 関西 / 東海 / 九州
株式会社アクト・テクニカルサポート,〒107-0052 東京都港区赤坂4-1-33 赤坂中西ビル5F,1989年4月1日,3名,登録なし,1999年,http://www.act.co.jp/,建築・土木,関東
株式会社アスカナ・コンサルティング,〒104-0061 東京都中央区銀座7丁目13番6号 サガミビル2F,2015年7月,登録なし,登録なし,2016年5月,http://asukana.co.jp/,企画・経営 / 営業 / 管理・事務 / 美容・ホテル・ブライダル・交通 / 保育・教育・通訳 / コンサルタント・金融・不動産専門職 / クリエイティブ / WEB・インターネット・ゲーム / ITエンジニア / 電気・電子・機械・半導体 / 医薬・食品・化学・素材 / 公共サービス,関東 / 北海道・東北 / 北信越 / 関西 / 東海 / 中国・四国 / 九州
アスキャリア【株式会社doubLe運営】,〒160-0023 東京都新宿区西新宿1-22-15 グラフィオ西新宿13Ｆ,2008年1月11日,1名,登録なし,平成24年12月1日,http://asu-career.jp/,営業,関東
アソート株式会社,〒530-0001 大阪府大阪市北区梅田1-2-2 大阪駅前第2ビル4階,平成9年4月,5名,登録なし,平成9年11月1日,http://www.assort.co.jp,医薬・食品・化学・素材 / 営業 / 企画・経営 / 電気・電子・機械・半導体,関西 / 関東 / 東海
株式会社あっぱれ,〒980-0803 宮城県仙台市青葉区国分町1丁目8-13　仙台協立第１ビル3階,2014年8月,登録なし,登録なし,2014年年11月,http://www.appare-japan.com,営業 / 企画・経営 / 管理・事務 / 販売・フード・アミューズメント / 電気・電子・機械・半導体,北海道・東北 / 関東 / 中国・四国
株式会社アップグレイド,〒101-0038 東京都千代田区神田美倉町10　喜助新神田ビル5F,2015年11月16日,6名,登録なし,2016年,http://www.upgrade1.co.jp,営業 / 企画・経営 / 管理・事務 / 販売・フード・アミューズメント / 医療・福祉 / 保育・教育・通訳 / コンサルタント・金融・不動産専門職 / WEB・インターネット・ゲーム / ITエンジニア / 電気・電子・機械・半導体 / 医薬・食品・化学・素材,【国内】 関東 / 北海道・東北 / 関西 / 東海 / 九州 【海外】 アメリカ・カナダ / ヨーロッパ
株式会社アドバハンティングサービス,〒460-0008 愛知県名古屋市中区栄3-14-7　RICCO栄 8階  【東京支社】 東京都新宿区西新宿1-26-2　新宿野村ビル11F,2016年7月,登録なし,登録なし,平成28年7月1日,http://www.adva-hs.jp,営業 / 管理・事務 / 販売・フード・アミューズメント / 医療・福祉 / 保育・教育・通訳 / ITエンジニア / 電気・電子・機械・半導体 / 建築・土木 / 技能工・設備・倉庫・農林水産・他,東海 / 北信越 / 関東
アドメイク株式会社,〒150-0002 東京都渋谷区渋谷2-12-15 日本薬学会長井記念館6F 各線渋谷駅から徒歩7分 ※ヒカリエ方面から出ていただくとスムーズに到着します,2008年5月8日,7名,登録なし,2016年,http://www.e-tenki.co.jp/,営業 / 企画・経営 / 管理・事務 / 販売・フード・アミューズメント / WEB・インターネット・ゲーム,関東 / 関西 / 東海
アニコム フロンティア株式会社,〒160-0023 東京都新宿区西新宿8-17-1 住友不動産新宿グランドタワー39階,2005年2月25日,3名,登録なし,2015年,http://www.anicom-frontier.com/,医療・福祉 / クリエイティブ / ITエンジニア / 医薬・食品・化学・素材,北海道・東北 / 北信越 / 関東 / 関西 / 東海 / 中国・四国 / 九州
株式会社アプリキュアケアクルー,〒160-0022 東京都新宿区新宿2-5-12 FORECAST 新宿AVENUE 4F432,2017年3月,4名,登録なし,2017年6月,http://curecare.a-dive.style/,医療・福祉,【国内】 関東 【海外】 その他海外
株式会社アムスコーポレーション,〒182-0024 東京都調布市布田1-44-3タカハシビル3階,1992年11月11日,2名,登録なし,2005年,https://www.ams-corp.co.jp/index.html,ITエンジニア / 管理・事務 / WEB・インターネット・ゲーム / 電気・電子・機械・半導体,関東
株式会社アモルデイジ,〒104-0045 東京都中央区築地1-9-2　イセツネビル６階,2006年1月4日,9名,登録なし,2006年7月1日,http://www.amoldage.co.jp/index.html,管理・事務 / コンサルタント・金融・不動産専門職 / 電気・電子・機械・半導体 / 医薬・食品・化学・素材,関東 / 関西
株式会社アルバイトタイムス,〒101-0043 東京都千代田区神田富山町５－１ 神田ビジネスキューブ,1973年10月29日,12名,登録なし,２０１２年,http://www.atimes.co.jp/,営業 / 管理・事務 / 販売・フード・アミューズメント / コンサルタント・金融・不動産専門職 / クリエイティブ / WEB・インターネット・ゲーム / ITエンジニア / 建築・土木,【国内】 東海 【海外】 その他アジア
株式会社アルファテック,〒105-0004 東京都港区新橋3丁目6-14　文銭堂ビル4F,2006年9月5日,10名,登録なし,2008年9月,http://alphatec-co.com/,営業 / 管理・事務 / 医療・福祉 / 保育・教育・通訳,登録なし
株式会社アルファ・リンク,〒101-0023 東京都千代田区神田松永町17-15,1991年11月28日,5名,登録なし,2011年10月,http://www.a-link.co.jp/jinzai/index2.html,管理・事務 / 営業 / 企画・経営 / 販売・フード・アミューズメント / コンサルタント・金融・不動産専門職 / 電気・電子・機械・半導体 / 建築・土木,北海道・東北 / 北信越 / 関東 / 関西 / 東海 / 中国・四国 / 九州
株式会社アロンジ,〒530-0044 大阪府大阪市北区東天満2-6-7 南森町東一号館9階,2016年11月24日,3名,登録なし,2017年,http://allonsy.co.jp/,営業 / 販売・フード・アミューズメント / 美容・ホテル・ブライダル・交通 / クリエイティブ / WEB・インターネット・ゲーム,関西 / 関東 / 東海
株式会社アンゼロ,〒104-0028 東京都中央区八重洲 2-10-8 八重洲ビル7階,2009年8月10日,8名,登録なし,2010年,http://www.unzero.co.jp/,営業 / 企画・経営 / 管理・事務 / コンサルタント・金融・不動産専門職 / ITエンジニア / 建築・土木 / 技能工・設備・倉庫・農林水産・他,【国内】 関東 / 関西 【海外】 中国 / 香港 / シンガポール / ヨーロッパ
株式会社アヴァンティスタッフ,〒103-0026 東京都中央区日本橋兜町6-7　ヒューリック兜町ビル,1984年9月,3名,登録なし,平成09年06月01,http://www.avantistaff.com/,営業 / 企画・経営 / 管理・事務 / 電気・電子・機械・半導体,【国内】 関西 【海外】 中国 / シンガポール
株式会社アートマネージメント,〒550-0011 大阪府大阪市西区阿波座1-14-4 サインカンパニービル202,2017年2月,2名,登録なし,2017年,登録なし,営業 / 企画・経営 / 販売・フード・アミューズメント / コンサルタント・金融・不動産専門職 / クリエイティブ / WEB・インターネット・ゲーム / ITエンジニア,関西 / 関東
RGF HR Agent Japan　（シーディエスアイ株式会社）,〒150-0012 東京都渋谷区広尾1-13-7 恵比寿イーストビル2F,2011年4月,89名,登録なし,1998年,http://www.rgf-hragent.asia/japan,登録なし,登録なし
株式会社アールストーン,〒171-0021 東京都豊島区西池袋2-41-8,2007年10月23日,32名,登録なし,平成20年07月,https://www.rstone-jp.com/,WEB・インターネット・ゲーム / クリエイティブ / ITエンジニア,関東
株式会社RD SUPPORT ｜食・化粧品・健康業界専門の転職エージェント,〒101-0052 東京都千代田区神田小川町1-1-15 D&F御茶ノ水ビル5階,1998年12月11日,11名,登録なし,2002年10月,http://www.rdsupport-tenshoku.jp/,医薬・食品・化学・素材 / 営業 / 企画・経営 / 管理・事務 / 医療・福祉,北海道・東北 / 北信越 / 関東 / 関西 / 東海 / 中国・四国 / 九州
株式会社R4CAREER,〒460-0008 愛知県名古屋市中区栄2-9-26ポーラ名古屋ビル3階,2009年4月21日,7名,登録なし,2009年7月,http://www.r4career.co.jp/,営業 / 企画・経営 / 管理・事務 / クリエイティブ / WEB・インターネット・ゲーム / ITエンジニア / 電気・電子・機械・半導体 / 建築・土木 / 医薬・食品・化学・素材,東海
株式会社イグニスブレイン,〒981-3203 宮城県仙台市泉区高森2-1-40 21世紀プラザ研究センター3F,2017年4月27日,2名,登録なし,2017年,http://ignis-brain.co.jp,電気・電子・機械・半導体 / 営業 / 企画・経営 / 管理・事務 / 販売・フード・アミューズメント / 美容・ホテル・ブライダル・交通 / 医療・福祉 / 保育・教育・通訳 / コンサルタント・金融・不動産専門職 / クリエイティブ / WEB・インターネット・ゲーム / ITエンジニア / 建築・土木 / 医薬・食品・化学・素材 / 技能工・設備・倉庫・農林水産・他 / 公共サービス,北海道・東北 / 北信越 / 関東 / 関西 / 東海 / 中国・四国 / 九州
株式会社イマジカデジタルスケープ,〒150-0043 東京都渋谷区道玄坂1-10-8　渋谷道玄坂東急ビル8Ｆ,1995年10月4日,登録なし,登録なし,1999年,http://www.dsp.co.jp/,クリエイティブ / WEB・インターネット・ゲーム / ITエンジニア,登録なし
株式会社イマジカデジタルスケープ大阪支店,〒150-0043 東京都渋谷区道玄坂1-10-8　渋谷野村ビル８階,1995年10月4日,登録なし,登録なし,1999年,http://www.dsp.co.jp,コンサルタント・金融・不動産専門職 / WEB・インターネット・ゲーム,登録なし
株式会社イン・ザ・ゾーン,〒103-0016 東京都中央区日本橋小網町8-2 BIZMARKS 日本橋茅場町8F,2017年5月26日,登録なし,登録なし,2017年,http://www.inthezone.co.jp,営業 / 管理・事務 / 保育・教育・通訳,関東
インター株式会社,〒106-0031 東京都港区西麻布一丁目11番6号　ホテル＆レジデンス六本木,平成26年12月,登録なし,登録なし,平成27年06月01,登録なし,営業 / 企画・経営 / 管理・事務 / 保育・教育・通訳 / コンサルタント・金融・不動産専門職 / クリエイティブ / WEB・インターネット・ゲーム / ITエンジニア,【国内】 関東 / 関西 【海外】 中国 / 韓国 / 香港 / シンガポール / その他アジア / オーストラリア / アメリカ・カナダ / ヨーロッパ
株式会社インタースクエア,〒530-0051 大阪府大阪市北区太融寺町5-13 東梅田パークビル4階,平成8年2月15日,11名,登録なし,2005年,https://www.intersquare.co.jp/,営業 / 医療・福祉 / 保育・教育・通訳 / 医薬・食品・化学・素材,関西
株式会社インターブリッジ,〒104-0032 東京都中央区八丁堀３－３－１　アーバネックス八丁堀５０３,２００７年１０月２日,登録なし,登録なし,２００８年１月,http://www.interbridge.jp/,企画・経営 / WEB・インターネット・ゲーム / 営業 / 管理・事務,登録なし
株式会社インターワークス,〒105-0003 東京都港区西新橋1-6-21　NBF虎ノ門ビル8階,1991年3月,153名,登録なし,2007年,http://www.i-am.jp/,電気・電子・機械・半導体 / 営業 / 企画・経営 / 管理・事務 / 販売・フード・アミューズメント / コンサルタント・金融・不動産専門職 / クリエイティブ / WEB・インターネット・ゲーム / ITエンジニア,関東 / 関西
株式会社インフィニティー,〒460-0003 愛知県名古屋市中区錦1-17-13　名興ビル5F,2002年,6名,登録なし,2002年,http://www.in-fy.com/,営業 / 企画・経営 / 管理・事務 / ITエンジニア / 電気・電子・機械・半導体 / 建築・土木,東海
株式会社インフォメーション・リサーチ研究所,〒550-0004 大阪府大阪市西区靭本町１－５－１５　第二富士ビル４Ｆ,１９９５年,2名,登録なし,１９９５年,http://www.e-iri.jp/,管理・事務 / 営業 / 企画・経営 / 医療・福祉 / ITエンジニア / 電気・電子・機械・半導体 / 建築・土木 / 医薬・食品・化学・素材,関西 / 関東
株式会社ウィズ,〒153-0064 東京都目黒区下目黒1-8-1 アルコタワー4F,1989年12月,10名,登録なし,2009年3月1日,https://www.kentakun.co.jp/,営業 / 管理・事務,登録なし
株式会社ウインネット,〒160-0022 東京都新宿区新宿３−３−１　龍王堂ビル６階,2001年12月14日,5名,登録なし,２００４年９月,http://www.winnet.jp,クリエイティブ / 医薬・食品・化学・素材,関東
ウェブスタッフ株式会社,〒150-0031 東京都渋谷区桜丘町20-1渋谷インフォスタワー5F,1998年10月,10名,登録なし,2002年3月,https://www.webstaff.jp/,WEB・インターネット・ゲーム / クリエイティブ / ITエンジニア,関西
ウェルソル株式会社,〒151-0053 東京都渋谷区代々木2-23-1 ニューステイトメナー372号室,2014/12/1,3名,登録なし,2014/12/1,http://well-solu.co.jp/,医療・福祉 / 営業 / 企画・経営 / 管理・事務 / クリエイティブ / WEB・インターネット・ゲーム / ITエンジニア,関東 / 関西
ヴォケイション・コンサルティング株式会社,〒100-0014 東京都千代田区永田町2-17-17-7F,2013年10月,4名,登録なし,2014年,http://vc-corp.net/,営業 / 管理・事務 / 美容・ホテル・ブライダル・交通 / コンサルタント・金融・不動産専門職 / WEB・インターネット・ゲーム / ITエンジニア / 建築・土木,関東 / 関西 / 東海
H＆innovation株式会社,〒104-0061 東京都中央区銀座8-17-5 アイオス銀座,2012年4月17日,1名,登録なし,2013年3月1日,http://www.h-innovation.com,営業 / 企画・経営 / 管理・事務 / WEB・インターネット・ゲーム / ITエンジニア,登録なし
HRイニシアティブ合同会社,〒980-0811 宮城県仙台市青葉区一番町２−９−２８−２１０６,2017年８月２日,登録なし,登録なし,2017年11月,https://www.hr-ini.com/,登録なし,【国内】 北海道・東北 / 関東 【海外】 その他アジア / その他海外
株式会社エイチワンコンサルティング,〒162-0066 東京都新宿区市谷台町6-2リッチライフ市谷台町ビル4F,1998年,2名,登録なし,1998年,http://www.h-one.co.jp/,ITエンジニア / 営業 / 企画・経営 / 管理・事務 / 医療・福祉 / コンサルタント・金融・不動産専門職 / WEB・インターネット・ゲーム,【国内】 関東 / 北海道・東北 / 北信越 / 関西 / 東海 / 中国・四国 / 九州 【海外】 中国 / 韓国 / シンガポール / その他アジア
株式会社エイドウィズ,〒101-0027 東京都千代田区神田平河町1番地 第3東ビル 3階 308号,2002年,2名,登録なし,2002,http://www.aidwiz.co.jp/,登録なし,登録なし
株式会社hape,〒150-0002 東京都渋谷区渋谷1-12-2　クロスオフィス渋谷5階,2013年11月,11名,登録なし,2014年5月1日,https://hape.co.jp/,営業 / 企画・経営,関東
株式会社エキスパートスタッフ【東京本社】,〒104-0061 東京都中央区銀座1-8-16 銀座アスタービル6F,昭和62年10月,2名,登録なし,1998年,http://www.expertstaff.co.jp/,クリエイティブ / 管理・事務 / WEB・インターネット・ゲーム / ITエンジニア,関東 / 関西
株式会社エスアイイー,〒101-0023 東京都千代田区神田松永町18ビオレ秋葉原３階,2004年6月1日,3名,登録なし,2009年8月1日,http://www.ssie.jp,営業 / WEB・インターネット・ゲーム,登録なし
株式会社エスキャリア,〒151-0053 東京都渋谷区代々木1-55-4　ヤマカドビル501,2011年11月,登録なし,登録なし,2016年2月,http://escareer.co.jp/,営業 / 管理・事務,関東
SBSスタッフ株式会社,〒130-0012 東京都墨田区太平四丁目1番３号　オリナスタワー10F,平成9年6月,登録なし,登録なし,平成29年3月,http://www.sbs-staff.co.jp/,営業 / 企画・経営 / 管理・事務 / 販売・フード・アミューズメント / 美容・ホテル・ブライダル・交通 / WEB・インターネット・ゲーム / ITエンジニア / 建築・土木 / 技能工・設備・倉庫・農林水産・他,関東
ＮＯＣアウトソーシング＆コンサルティング株式会社,〒135-0047 東京都江東区富岡1-13-6 NOCビル TEL：03-5646-2130（代表）,1965年9月,3名,登録なし,2012年4月1日,https://www.noc-net.co.jp/,クリエイティブ / WEB・インターネット・ゲーム,関東
NYI Inc.（株式会社エヌワイアイ）,〒550-0014 大阪府大阪市西区北堀江2-4-14　ミッドスクエア堀江　5F,2014年11月21日,3名,登録なし,2015年12月,http://nyi.jp/,販売・フード・アミューズメント / 営業 / 美容・ホテル・ブライダル・交通,関東 / 関西 / 東海 / 中国・四国
株式会社エバーコンサルティング,〒103-0027 東京都中央区日本橋3-5-12　ニュー八重洲ビル6階,2012年8月13日,登録なし,登録なし,2012年8月,http://ever-consul.co.jp/index.html,営業 / 管理・事務 / WEB・インターネット・ゲーム / ITエンジニア,【国内】 関東 / 北海道・東北 / 北信越 / 関西 / 東海 / 中国・四国 / 九州 【海外】 中国 / 韓国 / 香港 / シンガポール / その他アジア
株式会社エボルバビジネスサポート,〒104-0031 東京都中央区京橋2-5-18 京橋創生館5F,2011年7月29日,3名,登録なし,2010年10月1日,http://www.evolva-bs.co.jp/,管理・事務 / 営業 / 企画・経営,関東 / 関西 / 東海
株式会社エム・アイ・エル,〒101-0051 東京都千代田区神田神保町3−2−5　九段ロイヤルビル　6階,1998年9月,6名,登録なし,1998年,登録なし,管理・事務,登録なし
株式会社MS-Japan,〒102-0071 東京都千代田区富士見2-10-2 飯田橋グラン・ブルーム4F,1990年4月,126名,登録なし,1995年,https://tracker.adplan7.com/wa/c/r/p?md=3437&cp=31810&agr=8106782&ad=4269609,管理・事務 / 企画・経営 / コンサルタント・金融・不動産専門職,関東 / 関西 / 東海
株式会社エントラスト,〒170-0013 東京都豊島区東池袋4-21-1　アウルタワー614号,2006年9月20日,登録なし,登録なし,2006年,http://www.en-trust.co.jp,コンサルタント・金融・不動産専門職,登録なし
株式会社エンなび,〒107-0061 東京都港区北青山2-7-26 Landwork青山ビル2F・4F  (受付は2階になります),2013年4月,4名,登録なし,2017年2月,http://en-navi.co.jp/,営業 / 企画・経営 / 美容・ホテル・ブライダル・交通 / 医療・福祉 / コンサルタント・金融・不動産専門職 / WEB・インターネット・ゲーム / 公共サービス,北海道・東北 / 北信越 / 関東 / 関西 / 東海 / 中国・四国 / 九州
株式会社Ａキャリア,〒171-0022 東京都豊島区南池袋2-41-12　池袋セントラル201,2012年12月1日,登録なし,登録なし,2012年12月1日,登録なし,管理・事務 / コンサルタント・金融・不動産専門職 / ITエンジニア,【国内】 関東 / 北海道・東北 / 北信越 / 中国・四国 【海外】 中国 / その他アジア
株式会社ACR,〒810-0004 福岡県福岡市中央区渡辺通4-10-10 紙与天神ビル2F,昭和42年1月16日,登録なし,登録なし,昭和45年,http://www.acr.gr.jp/?mode=pc,登録なし,九州
株式会社エージェントキューブ,〒107-0052 東京都港区赤坂3-18-2　第1三州ビル 3階,2013年1月17日,8名,登録なし,2013年,http://www.agent3.co.jp/,営業,登録なし
