株式会社シグマスタッフ,〒141-0021 東京都品川区上大崎2-25-2 新目黒東急ビル6階,1983年2月,2名,登録なし,2003年9月1日,http://www.sigma-staff.co.jp/,管理・事務 / 営業 / 企画・経営 / 販売・フード・アミューズメント / 美容・ホテル・ブライダル・交通 / 医療・福祉 / 保育・教育・通訳 / コンサルタント・金融・不動産専門職 / クリエイティブ / 建築・土木 / 医薬・食品・化学・素材 / 技能工・設備・倉庫・農林水産・他,関東 / 北海道・東北 / 北信越 / 関西 / 東海 / 中国・四国 / 九州
シリコンスタジオ株式会社,〒150-0013 東京都渋谷区恵比寿1-21-3　NRビル1F～4F,2000年1月1日,6名,登録なし,2004年7月,http://www.siliconstudio.co.jp/,WEB・インターネット・ゲーム / 管理・事務,関東 / 関西 / 九州
株式会社シンフォニック・バリューズ,〒150-0002 東京都渋谷区渋谷3丁目1番8号 オーベル渋谷5階,2017年4月13日,1名,登録なし,2017年7月,https://symphonic-values.com/company/,コンサルタント・金融・不動産専門職 / 営業 / 管理・事務 / クリエイティブ / ITエンジニア / 建築・土木,関東
株式会社Symphoneed（旧：株式会社TYMコーポレーション）,〒101-0052 東京都千代田区神田小川町2丁目3-3 神田小川町SKYビル5F,2009年11月1日,13名,登録なし,2009年12月,http://www.symphoneed.co.jp/,営業 / 企画・経営 / クリエイティブ / WEB・インターネット・ゲーム,関東 / 関西 / 九州
株式会社CIN GROUP,〒150-0002 東京都渋谷区渋谷3-12-22 渋谷プレステージ5F,2012年7月,6名,登録なし,2014年,http://www.cin-group.com/,営業 / 管理・事務 / 販売・フード・アミューズメント / 美容・ホテル・ブライダル・交通 / 保育・教育・通訳 / クリエイティブ / WEB・インターネット・ゲーム,関東 / 関西
株式会社C&Rリーガル・エージェンシー社,〒102-0083 東京都千代田区麹町2-10-9　C&Rグループビル,2007年8月29日,登録なし,登録なし,平成19年11月01,https://legal-agent.jp/,管理・事務,関東 / 北海道・東北 / 北信越 / 関西 / 東海 / 中国・四国 / 九州
株式会社シーエス,〒222-0033 神奈川県横浜市港北区新横浜3-22-5　8F,2008年9月,2名,登録なし,2017年10月,https://q-s.work/,営業 / 企画・経営 / 管理・事務 / 電気・電子・機械・半導体,関東
合同会社CS企画,〒661-0983 兵庫県尼崎市口田中1丁目18-6　中村鶴翔ビルＶ1階,2015年9月,1名,登録なし,平成27年12月01,http://www.cskikaku.com/,営業 / 企画・経営 / 医療・福祉 / WEB・インターネット・ゲーム / ITエンジニア / 電気・電子・機械・半導体 / 建築・土木 / 医薬・食品・化学・素材,関西 / 北海道・東北 / 北信越 / 関東 / 東海 / 中国・四国 / 九州
株式会社シースタイル,〒103-0012 東京都中央区日本橋堀留町1－8－12　さくら堀留ビル8階,2004年1月,登録なし,登録なし,2017年10月,http://www.cstyle.co.jp/,コンサルタント・金融・不動産専門職 / 営業 / 管理・事務 / 建築・土木,関東
シーディエスアイ株式会社(CDS),〒150-0011 東京都渋谷区東3-14-20 ニューホライズンエビス,1998年4月28日,登録なし,登録なし,1998年,http://www.cds-consulting.com/j/,建築・土木 / 営業 / コンサルタント・金融・不動産専門職 / WEB・インターネット・ゲーム / ITエンジニア / 電気・電子・機械・半導体 / 医薬・食品・化学・素材,関東
株式会社 ジェイ エイ シー リクルートメント,〒101-0051 東京都千代田区神田神保町1-105　神保町三井ビルディング14階,1988年3月7日,650名,登録なし,1988年,http://www.jac-recruitment.jp/,営業 / 企画・経営 / 管理・事務 / コンサルタント・金融・不動産専門職 / クリエイティブ / WEB・インターネット・ゲーム / ITエンジニア / 電気・電子・機械・半導体 / 医薬・食品・化学・素材,関東 / 関西 / 東海 / 中国・四国
ジェイエス株式会社,〒980-0811 宮城県仙台市青葉区一番町2-5-5,2000年6月20日,登録なし,登録なし,2007年,http://www.js-biz.co.jp/,管理・事務 / 医療・福祉 / ITエンジニア / 医薬・食品・化学・素材,登録なし
JXキャリアサポート株式会社,〒100-0005 東京都千代田区丸の内三丁目4番2号（新日石ビルヂング6階）,1988年4月1日,登録なし,登録なし,1998年04月01,http://www.cs.jx-group.co.jp/,登録なし,登録なし
株式会社ジェイック (キャリアチェンジカレッジ),〒101-0051 東京都千代田区神田神保町1-101 神保町101ビル6F,1991年3月,2名,登録なし,2001年,http://www.jaic-g.com/,営業 / 企画・経営 / 管理・事務 / 販売・フード・アミューズメント / コンサルタント・金融・不動産専門職 / WEB・インターネット・ゲーム / ITエンジニア / 建築・土木,関東
ジャスネットコミュニケーションズ株式会社 関西支社,〒102-0083 東京都千代田区麹町　2丁目10番9号 C&Rグループビル1F,1996年8月,4名,登録なし,平成10年5月1日,http://career.jusnet.co.jp/kansai/,管理・事務 / 企画・経営 / コンサルタント・金融・不動産専門職,関西 / 関東 / 九州
ジャパンラーニング株式会社,〒103-0027 東京都中央区日本橋2-2-6 日本橋通り二丁目ビル6Ｆ,1996年6月1日,3名,登録なし,2010年4月1日,http://www.japan-learning.co.jp/,ITエンジニア,【国内】 関東 【海外】 その他アジア
株式会社juice up 〜20代、30代専門エージェント！〜,〒105-0004 東京都港区新橋3-11-8　オーイズミ新橋第２ビル801,2014年7月1日,6名,登録なし,2015年,https://juice-up.co.jp/,営業 / 企画・経営 / 管理・事務 / 医療・福祉 / コンサルタント・金融・不動産専門職 / クリエイティブ / WEB・インターネット・ゲーム / ITエンジニア / 電気・電子・機械・半導体,関東 / 関西
JOB転職エージェント（株式会社アルバイトタイムス）,〒101-0043 東京都千代田区神田富山町5-1 神田ビジネスキューブ 7F・8F（総合受付8F）,1973年10月29日,15名,登録なし,平成21年06月,登録なし,営業 / 企画・経営 / 管理・事務 / 販売・フード・アミューズメント / 美容・ホテル・ブライダル・交通 / 技能工・設備・倉庫・農林水産・他,関東
株式会社ジョブ・ライフサポート,〒540-0026 大阪府大阪市中央区内本町2-1-19 内本町松屋ビル10-1002,平成22年1月,2名,登録なし,2014年7月1日,http://www.jl-support.com/defaultTop.asp,管理・事務 / 建築・土木,登録なし
株式会社ジョブワールド,〒542-0066 大阪府大阪市中央区瓦屋町3-7-3　イースマイルビル4階,2017年5月1日,4名,登録なし,2017年7月,http://www.job-world.jp/,登録なし,登録なし
人材アシスト株式会社,〒541-0041 大阪府大阪市中央区北浜2-1-21　北浜ゲイトビル 6F,2004年3月25日,3名,登録なし,平成16年6月1日,http://www.sr-jinzai.co.jp/,営業 / 企画・経営 / 管理・事務 / 美容・ホテル・ブライダル・交通 / 建築・土木 / 医薬・食品・化学・素材,関西
株式会社人材情報センター,〒920-0024 石川県金沢市西念1-1-3,1985年9月,15名,登録なし,2000年,http://www.jjc-net.co.jp/company/index.html,電気・電子・機械・半導体,北信越
株式会社人材テラス,〒541-0054 大阪府大阪市中央区南本町2-2-5　イケマンビル8階,2017年,9名,登録なし,2017年,https://jinzai-terrace.com/,コンサルタント・金融・不動産専門職 / 営業,関西
株式会社ジンザイリンク,〒577-0054 大阪府東大阪市高井田元町2-8-1　永和ビル2F,2015年６月,登録なし,登録なし,2015年,https://jinzai-link.co.jp/,営業 / 管理・事務 / 美容・ホテル・ブライダル・交通 / ITエンジニア / 電気・電子・機械・半導体 / 建築・土木,北海道・東北 / 北信越 / 関東 / 関西 / 東海 / 中国・四国 / 九州
株式会社ジンジブ（人と未来グループ）,〒105-0012 東京都港区芝大門2-3-1 常泉ビル4F  tel：03-5777-2679 fax：03-5777-2689,2014年2月,登録なし,登録なし,2014年6月,登録なし,保育・教育・通訳 / 営業 / 企画・経営 / 管理・事務 / 販売・フード・アミューズメント / 医療・福祉 / コンサルタント・金融・不動産専門職 / クリエイティブ / WEB・インターネット・ゲーム,関東 / 関西 / 九州
株式会社スイッチカンパニー,〒790-0065 愛媛県松山市宮西1丁目8-12　宮西ビル2階,2013年11月22日,3名,登録なし,平成26年7月1日,http://www.switch-net.co.jp/,営業 / ITエンジニア / 電気・電子・機械・半導体,中国・四国
株式会社Skill Matching フードパートナーズ事業部,〒541-0056 大阪府大阪市中央区久太郎町4-2-12 本町TDビル8階,2017年3月,2名,登録なし,平成29年6月1日,http://foodpartners.jp/lp/,販売・フード・アミューズメント,関西
star arts株式会社,〒102-0083 東京都千代田区麹町4-8-1 クリスタルシティ西館 THE MOCK-UP TOKYO 213,2012年4月,5名,登録なし,平成29年4月1日,http://stararts.co.jp/,営業 / 企画・経営 / 管理・事務 / 美容・ホテル・ブライダル・交通 / 医療・福祉 / コンサルタント・金融・不動産専門職 / クリエイティブ / WEB・インターネット・ゲーム / ITエンジニア,北海道・東北 / 北信越 / 関東 / 関西 / 東海 / 中国・四国 / 九州
株式会社スターリーグ,〒150-0032 東京都渋谷区鶯谷町15－9　カザマビル401,2016年3月,登録なし,登録なし,2016年8月,https://star.careers/company/,営業 / 企画・経営 / 管理・事務 / コンサルタント・金融・不動産専門職 / WEB・インターネット・ゲーム,関東 / 関西 / 九州
株式会社SPACIVAL,〒101-0032 東京都千代田区岩本町3-3-3 秋葉原サザンビル6階,2017年10月5日,3名,登録なし,2018年2月1日,http://spacival.com/index.html,営業 / 企画・経営 / 管理・事務 / 販売・フード・アミューズメント / 医療・福祉 / コンサルタント・金融・不動産専門職 / WEB・インターネット・ゲーム / ITエンジニア / 電気・電子・機械・半導体,関東
Spring転職エージェント（アデコ株式会社）,〒107-0062 東京都港区南青山1-15-9,1985年7月29日,登録なし,登録なし,2000年11月,http://www.springjapan.com/,営業 / 企画・経営 / 管理・事務 / コンサルタント・金融・不動産専門職 / WEB・インターネット・ゲーム / ITエンジニア / 電気・電子・機械・半導体 / 医薬・食品・化学・素材,関東 / 関西 / 東海
Spotted Recruit（株式会社SPOTTED）,〒103-0026 東京都中央区日本橋兜町5-1　兜町第一平和ビル3階,2017年4月,登録なし,登録なし,2017年8月,http://spottedrecruit.com/,営業 / 管理・事務 / クリエイティブ / WEB・インターネット・ゲーム / ITエンジニア,関東
株式会社スポーツフィールド,〒162-0845 東京都新宿区市谷本村町3-29　FORECAST市ヶ谷4F,2009年,23名,登録なし,2009年,http://www.sports-f.co.jp/,営業 / 企画・経営 / 保育・教育・通訳 / クリエイティブ / 建築・土木,北海道・東北 / 関東 / 関西 / 東海 / 九州
株式会社3Backs,〒151-0051 東京都渋谷区千駄ヶ谷2-9-6 バルビゾン3番館 B1,2009年11月26日,3名,登録なし,平成29年8月1日,http://www.3backs.com/,営業 / 企画・経営 / 管理・事務 / ITエンジニア,登録なし
株式会社スリールアーク,〒141-0032 東京都品川区大崎5-1-5 高徳ビル4階,2016年7月1日,登録なし,登録なし,2017年7月1日,http://www.sourirearc.jp/,販売・フード・アミューズメント,関東
株式会社セゾンパーソナルプラス,〒170-0013 東京都豊島区東池袋1-33-8 NBF池袋タワー6階,2002年11月1日,登録なし,登録なし,2005年8月1日,http://www.saison-psp.co.jp/,営業 / 管理・事務,関東
戦力エージェント株式会社,〒160-0022 東京都新宿区新宿1-4-11　御苑一丁目ビル 8F,平成9年10月,5名,登録なし,平成14年4月,http://www.senage.co.jp/,営業 / 企画・経営 / 管理・事務,登録なし
株式会社セールスキャリアエージェント,〒104-0045 東京都中央区築地2-12-6 SK東銀座ビル5階,2014年7月22日,10名,登録なし,2014年,http://www.sales-career-agent.co.jp/,営業,北海道・東北 / 北信越 / 関東 / 関西 / 東海 / 中国・四国 / 九州
株式会社ZENITH,〒466-0064 愛知県名古屋市昭和区鶴舞3丁目12-2,2017年1月27日,2名,登録なし,2017年5月1日,https://www.zenith-agent.co.jp,営業,東海
株式会社ゼネラルリンク,〒150-0002 東京都渋谷区渋谷2-12-9　エスティ青山ビルB1F、2F、3F（受付：3F）,2004年10月,5名,登録なし,平成28年10月01,https://general-link.co.jp/,営業 / 企画・経営 / 管理・事務 / コンサルタント・金融・不動産専門職 / WEB・インターネット・ゲーム / ITエンジニア / 電気・電子・機械・半導体 / 建築・土木 / 医薬・食品・化学・素材 / 技能工・設備・倉庫・農林水産・他,関東 / 北信越
株式会社ソシアリンク,〒160-0023 東京都新宿区西新宿1-8-1　新宿ビルディング6階,2002年9月,4名,登録なし,2002年,http://www.socialink.co.jp/,営業 / 企画・経営 / 管理・事務 / 販売・フード・アミューズメント / WEB・インターネット・ゲーム / 医薬・食品・化学・素材,北海道・東北 / 関東 / 関西 / 東海
株式会社ソルパック,〒106-0032 東京都港区六本木 4-1-4　黒崎ビル8階,1997年9月17日,4名,登録なし,2001/4/1,http://www.solpac.co.jp/,ITエンジニア,関東
大成交易株式会社,〒108-0023 東京都港区芝浦3丁目14番19号,昭和４３年４月２日,登録なし,登録なし,２０１７年１月,登録なし,営業,関東
株式会社宝木スタッフサービス,〒321-0953 栃木県宇都宮市東宿郷5-2-5,平成2年1月,登録なし,登録なし,平成10年6月,http://www.takaragi.co.jp/index.html,美容・ホテル・ブライダル・交通 / 営業 / 企画・経営 / 管理・事務 / 販売・フード・アミューズメント / 医療・福祉 / 電気・電子・機械・半導体 / 建築・土木 / 医薬・食品・化学・素材 / 技能工・設備・倉庫・農林水産・他,関東 / 北海道・東北 / 北信越 / 関西 / 東海
株式会社ＴＡＣプロフェッションバンク,〒101-0061 東京都千代田区三崎町3-2-14　ＴＣ水道橋ビル7Ｆ,２００１年５月,登録なし,登録なし,2001年,http://tacnavi.com/index.html,管理・事務 / コンサルタント・金融・不動産専門職,関西 / 関東 / 東海
株式会社ダイナリィ,〒802-0076 福岡県北九州市小倉北区中島1-17-13　ダイナリィコアビル1F,平成12年10月10日,2名,登録なし,平成14年12月,http://www.dynary.co.jp/,管理・事務 / 営業 / 企画・経営 / 医療・福祉 / 保育・教育・通訳 / WEB・インターネット・ゲーム / ITエンジニア / 電気・電子・機械・半導体 / 建築・土木 / 技能工・設備・倉庫・農林水産・他,九州
株式会社ダイネンヒューマンplus,〒670-0012 兵庫県姫路市本町240番地　大手前ダイネンBLD．5階,2006年2月,7名,登録なし,2006年,https://career.hari-match.com/,電気・電子・機械・半導体,関西
株式会社ダンネット,〒103-0012 東京都中央区日本橋堀留町1-5-7 YOUビル2階,2005年8月1日,14名,登録なし,2005年11月,http://www.dannet.jp/,管理・事務 / 電気・電子・機械・半導体 / 医薬・食品・化学・素材,その他海外
株式会社Change Value,〒151-0051 東京都渋谷区千駄ヶ谷五丁目26番5号2階,2015年11月,3名,登録なし,2016年,http://changevalue.jp/,営業 / 企画・経営 / 管理・事務 / ITエンジニア,関東
株式会社　ツクリベニッセ,〒173-0033 東京都板橋区大山西町45-3,1998年5月15日,2名,登録なし,2007年,http://www.tsukuribe-nisse.co.jp/index.html,営業,登録なし
株式会社テクニカルエージェント,〒482-0022 愛知県岩倉市栄町2-21　あすなろビル3階,2013年7月,1名,登録なし,平成26年04月01,http://technical-agent.jp/,電気・電子・機械・半導体 / ITエンジニア,東海
テクノインテリジェンスサービス株式会社,〒260-0028 千葉県千葉市中央区新町1000,1993年7月1日,6名,登録なし,2003年,http://tis-jinzai.com,管理・事務 / 電気・電子・機械・半導体 / 医薬・食品・化学・素材,登録なし
株式会社テクノプロ・コンストラクション（東証一部 テクノプロホールディングス グループ）,〒106-6135 東京都港区六本木6-10-1　六本木ヒルズ森タワー35F,2008年11月,13名,登録なし,2009年,http://www.technopro-construction.com/,建築・土木,北海道・東北 / 北信越 / 関東 / 関西 / 東海 / 中国・四国 / 九州
転職会議エージェント（株式会社リブセンス）,〒141-0021 東京都品川区上大崎2-25-2 新目黒東急ビル5F,2006年2月8日,14名,登録なし,平成25年8月1日,http://www.livesense.co.jp/,管理・事務 / 営業 / 企画・経営 / コンサルタント・金融・不動産専門職 / WEB・インターネット・ゲーム / ITエンジニア / 建築・土木,関東 / 関西 / 東海
テンプスタッフ・クリエイティブ株式会社,〒107-0061 東京都港区北青山3-5-14 青山鈴木硝子ビル4階,２００２年,登録なし,登録なし,２００２年８月,http://www.tempcreative.co.jp/,クリエイティブ / WEB・インターネット・ゲーム,関東
テンプスタッフフォーラム株式会社,〒950-0087 新潟県新潟市中央区東大通1-7-10 新潟セントラルビル6F,1988年4月23日,4名,登録なし,1999年2月1日,https://career.tempstaff-forum.co.jp/,管理・事務 / 営業 / 企画・経営 / 建築・土木,北信越 / 関東 / 中国・四国 / 九州
株式会社テンプ・マキノ,〒663-8113 兵庫県西宮市甲子園口2丁目28-20　林ビル3階,2006年11月,登録なし,登録なし,2007年,http://temp-makino.com/,電気・電子・機械・半導体 / 営業 / 企画・経営 / 管理・事務 / 医療・福祉 / ITエンジニア / 医薬・食品・化学・素材,関西 / 関東 / 東海
株式会社 ディーエスキャリア,〒105-0004 東京都港区新橋4-27-1　セントラルビル6F,2016年5月26日,2名,登録なし,2016年9月,http://ds-career.co.jp/,管理・事務 / 建築・土木,登録なし
東京事務代行株式会社,〒105-0012 東京都港区芝大門2-5-5　住友芝大門ビル4階,昭和40年9月,登録なし,登録なし,平成15年,https://tokyo-jimukyujin.com/corporate,企画・経営 / 管理・事務,関東
東レエンタープライズ株式会社,〒103-0023 東京都中央区日本橋本町1-5-9　ＫＤＸ日本橋本町ビル,１９７２年１月,登録なし,登録なし,１９８９年,http://www.toray-enter.co.jp/,クリエイティブ / 電気・電子・機械・半導体 / 医薬・食品・化学・素材,【国内】 関東 / 関西 【海外】 中国 / その他アジア
東レエンタープライズ株式会社　人材サービス部,〒103-0023 東京都中央区日本橋本町1-5-9　ＫＤＸ日本橋本町ビル,１９７２年１月,登録なし,登録なし,１９８９年,http://www.toray-enter.co.jp/,営業 / 管理・事務 / 医療・福祉,関東 / 関西 / 東海
株式会社都市整備技術研究所（転職・キャリアメンター）,〒105-0022 東京都港区海岸1-2-3　汐留芝離宮ビルディング21F,平成2年6月4日,登録なし,登録なし,平成27年11月1日,http://www.tcareer-mentor.jp/,管理・事務 / 営業 / 企画・経営 / 販売・フード・アミューズメント / 美容・ホテル・ブライダル・交通 / コンサルタント・金融・不動産専門職 / ITエンジニア / 電気・電子・機械・半導体 / 建築・土木 / 技能工・設備・倉庫・農林水産・他,【国内】 関東 / 北海道・東北 / 北信越 / 関西 / 東海 / 中国・四国 / 九州 【海外】 シンガポール / その他アジア / アメリカ・カナダ
株式会社Tryfunds,〒105-0003 東京都港区西新橋3丁目24番10号 ハリファックス御成門ビル3階,2012年9月,登録なし,登録なし,平成27年7月1日,http://www.tryfunds.co.jp/,企画・経営 / 営業 / 管理・事務 / コンサルタント・金融・不動産専門職 / クリエイティブ / WEB・インターネット・ゲーム / ITエンジニア / 電気・電子・機械・半導体,【国内】 中国・四国 / 関東 / 九州 【海外】 その他海外
株式会社トライブ,〒150-0044 東京都渋谷区円山町5-5　NAVI渋谷V5階,2006年5月23日,50名,登録なし,2008年,https://tribe.bz/contents/,WEB・インターネット・ゲーム / クリエイティブ / ITエンジニア,関東
株式会社トライポイント,〒540-0008 大阪府大阪市中央区大手前1-6-4 リップル天満橋ビル3F,2005年11月,2名,登録なし,平成21年2月,http://www.tripoint.co.jp/,建築・土木,登録なし
トラスト＆パッションカンパニー株式会社,〒113-0033 東京都文京区本郷3−2−6　クレスト山の上ビル　2階,2014/5/21,登録なし,登録なし,2014/8/1,http://www.t-and-p.co.jp/,登録なし,関東 / 関西 / 九州
株式会社トラスト・プラン,〒107-0052 東京都港区赤坂3丁目13-3 赤坂セントラルビル7F,2010年,登録なし,登録なし,平成28年08月,http://www.trustplan.jp/,営業 / 企画・経営 / 管理・事務 / 保育・教育・通訳 / ITエンジニア / 建築・土木,登録なし
トランク株式会社,〒150-0013 東京都渋谷区恵比寿 3-3-8 ラピツカキヌマ　3階,2009年10月1日,10名,登録なし,2012年7月,http://trunkc.jp/,営業 / 企画・経営 / 管理・事務 / クリエイティブ / WEB・インターネット・ゲーム,【国内】 関東 【海外】 その他海外
株式会社eee（トリプルイー）,〒541-0048 大阪府大阪市中央区瓦町3-3-16 OWL瓦町ビル701号室,2015年8月25日,2名,登録なし,2015年11月,http://eee-g.net/index.html,建築・土木,北海道・東北 / 北信越 / 関東 / 関西 / 東海 / 中国・四国
株式会社トレジャー・パーソンズ,〒162-0812 東京都新宿区西五軒町8-10臼井ビル５階,2016年4月15日,5名,登録なし,2016年８月,http://www.trep.jp,営業 / 企画・経営 / 管理・事務 / コンサルタント・金融・不動産専門職 / クリエイティブ / WEB・インターネット・ゲーム / ITエンジニア / 電気・電子・機械・半導体,関東 / 関西
株式会社トーテック,〒100-0006 東京都千代田区有楽町1-7-1 有楽町電気ビル北館6Ｆ,2003年 2月,14名,登録なし,2003年10月1日,http://www.totec-net.com/,電気・電子・機械・半導体 / 営業 / WEB・インターネット・ゲーム / ITエンジニア / 医薬・食品・化学・素材 / 技能工・設備・倉庫・農林水産・他,関東 / 関西 / 九州
株式会社ドルチェインターナショナル,〒107-0052 東京都港区赤坂６−３−１２,１９９９年１１月,23名,登録なし,２００２年１月,http://www.dolceintl.com/,電気・電子・機械・半導体 / 医療・福祉 / 管理・事務,登録なし
株式会社ナインサーチ,〒812-0013 福岡県福岡市博多区博多駅東1-10-4　ＭＡＳビル2階,2016年7月22日,2名,登録なし,2016年,www.ninesearch.co.jp,電気・電子・機械・半導体 / 営業 / 企画・経営 / 管理・事務 / コンサルタント・金融・不動産専門職,九州 / 中国・四国
有限会社ナカムラ電装,〒160-0023 東京都新宿区西新宿（次のビルを除く）7－7－27第一守徳ビル4階 JR　新宿駅　西口から徒歩10分 大江戸線　新宿西口　D５出口より、西新宿７丁目郵便局を過ぎ、新宿都税事務所の信号の先、守徳ビル４階です。,1987年,2名,登録なし,2017年5月,https://www.nakamura-den.com/,営業 / 企画・経営 / 医療・福祉 / 電気・電子・機械・半導体 / 建築・土木 / 医薬・食品・化学・素材 / 技能工・設備・倉庫・農林水産・他,関東 / 北海道・東北 / 北信越 / 関西 / 東海 / 中国・四国 / 九州
西日本エリートスタッフ株式会社,〒830-0017 福岡県久留米市日吉町15-60　ニッセイ久留米ビル9F,1987年10月,2名,登録なし,平成10年05月01,http://www.elite-staff.com/,登録なし,九州
