日総工産株式会社,〒222-0033 神奈川県横浜市港北区新横浜1-4-1 日総工産新横浜ビル,1971年2月3日,6名,登録なし,2002年8月,http://www.nisso.co.jp/,電気・電子・機械・半導体 / 営業 / 企画・経営 / 管理・事務 / WEB・インターネット・ゲーム / ITエンジニア / 医薬・食品・化学・素材 / 技能工・設備・倉庫・農林水産・他,【国内】 関東 / 北海道・東北 / 北信越 / 関西 / 東海 / 中国・四国 / 九州 【海外】 中国 / その他アジア
日総ブレイン株式会社,〒230-0062 神奈川県横浜市神奈川区鶴屋町 2-23-2 TSプラザビルディング16F,1986年3月13日,4名,登録なし,平成12年8月,https://www.nsbrain.jp/,営業 / 企画・経営 / 管理・事務 / ITエンジニア / 電気・電子・機械・半導体 / 建築・土木 / 医薬・食品・化学・素材 / 技能工・設備・倉庫・農林水産・他,【国内】 北海道・東北 / 北信越 / 関東 / 関西 / 中国・四国 / 九州 【海外】 中国 / 韓国 / その他アジア
株式会社日本調理師協会,〒160-0022 東京都新宿区新宿1-36-2新宿第七葉山ビル3階,1978年（昭和53年）,登録なし,登録なし,昭和60年,http://www.chorishi.net/,販売・フード・アミューズメント,登録なし
株式会社日本テレビ人材センター,〒105-0021 東京都港区東新橋2-3-3 ルオーゴ汐留6階,1987年3月3日,4名,登録なし,平成17年11月1日,http://www.ntvpc.co.jp/,営業 / 管理・事務 / クリエイティブ / WEB・インターネット・ゲーム,関東
株式会社日本みらいケア,〒180-0004 東京都武蔵野市吉祥寺本町1-31-11 KSビル11階,2016年2月,3名,登録なし,2016年,http://miraicare.co.jp/,医療・福祉 / 営業 / 企画・経営 / 管理・事務 / コンサルタント・金融・不動産専門職,関東
株式会社ニューキャリア,〒105-0003 東京都港区西新橋1-11-3　虎ノ門アサヒビル5階,2003/7/17,5名,登録なし,2003年10月1日,http://www.newcareer.co.jp/,管理・事務 / 電気・電子・機械・半導体,登録なし
株式会社NEO STAFF（転職支援サービス NEO STAFF NEXT）,〒980-6126 宮城県仙台市青葉区1‐3‐1 AERビル29F,2005年7月11日,登録なし,登録なし,平成20年8月1日,http://neo-staff-next.jp/,営業 / 企画・経営 / 管理・事務 / 販売・フード・アミューズメント / WEB・インターネット・ゲーム / ITエンジニア / 建築・土木 / 医薬・食品・化学・素材 / 技能工・設備・倉庫・農林水産・他,北海道・東北
株式会社ネットセーブ,〒107-0052 東京都港区赤坂1-4-1 赤坂KSビル4階,2000年11月1日,登録なし,登録なし,平成17年10月,登録なし,建築・土木 / 技能工・設備・倉庫・農林水産・他,その他アジア
株式会社ノース,〒221-0835 神奈川県横浜市神奈川区鶴屋町2-22-3 伊藤ビル5F,2004年3月,2名,登録なし,2010年,https://north-h.jp/,営業 / 販売・フード・アミューズメント / ITエンジニア,北海道・東北 / 北信越 / 関東 / 関西 / 東海 / 中国・四国 / 九州
八洋企画株式会社,〒810-0071 福岡県福岡市中央区那の津3-7-7,昭和49年08月,登録なし,登録なし,2017年4月,登録なし,営業 / 管理・事務 / 販売・フード・アミューズメント,九州 / 関東 / 関西
株式会社ハッピー・マーク,〒550-0014 大阪府大阪市西区北堀江1-1-7　四ツ橋日生ビル本館8F,2011年11月,登録なし,登録なし,2012年3月1日,http://www.happy-mark.co.jp/,保育・教育・通訳 / 営業 / 企画・経営 / 管理・事務,関西 / 関東
パナソニック エクセルスタッフ株式会社,〒540-6102 大阪府大阪市中央区城見2-1-61　TWIN21MIDタワー2階,1989年3月,9名,登録なし,1989年,https://tensyoku-excel.panasonic.co.jp/,営業,登録なし
株式会社パーソネル,〒460-0003 愛知県名古屋市中区錦三丁目23番18号　ニューサカエビル7F,1997年9月19日,5名,登録なし,1997年,http://www.perso.co.jp,登録なし,登録なし
バレットグループ株式会社,〒160-0022 東京都新宿区新宿5-18-14　新宿北西ビル10F,2013年,1名,登録なし,2013年,https://bltinc.co.jp/,医療・福祉 / ITエンジニア,関東
株式会社バンステーション,〒530-0005 大阪府大阪市北区中之島4-2-28　甲南アセット中之島,1992年,登録なし,登録なし,1992年,http://www.vanstation.com,企画・経営 / 営業 / 管理・事務 / 医療・福祉 / コンサルタント・金融・不動産専門職 / クリエイティブ / WEB・インターネット・ゲーム / ITエンジニア / 電気・電子・機械・半導体 / 建築・土木 / 医薬・食品・化学・素材 / 技能工・設備・倉庫・農林水産・他,【国内】 関西 / 東海 / 中国・四国 【海外】 その他アジア
株式会社パコム,〒541-0048 大阪府大阪市中央区瓦町4丁目3-7　OSJ御堂筋瓦町ビル2階,1995年8月,3名,登録なし,2004年,http://www.pacom.co.jp/,営業 / 管理・事務 / 販売・フード・アミューズメント / WEB・インターネット・ゲーム,登録なし
株式会社パシフィックキャリアデザイン,〒461-0001 愛知県名古屋市東区泉一丁目23番37号　パシフィックビルディング6階,2016年12月,5名,登録なし,2017年3月,https://p-cd.co.jp,営業 / 医療・福祉 / 保育・教育・通訳 / 電気・電子・機械・半導体 / 技能工・設備・倉庫・農林水産・他,東海
株式会社パソナ　パソナキャリアカンパニー,〒100-8228 東京都千代田区大手町2-6-2　パソナグループ本部ビル『Job-Hubスクエア』7階,１９８８年４月１４日,150名,登録なし,２０００年,http://www.pasonacareer.jp/,管理・事務 / 営業 / 企画・経営 / 医療・福祉 / コンサルタント・金融・不動産専門職 / WEB・インターネット・ゲーム / ITエンジニア / 電気・電子・機械・半導体 / 建築・土木 / 医薬・食品・化学・素材,関東 / 関西 / 東海
株式会社パソナ　パソナカンパニー　グローバル事業本部,〒100-8228 東京都千代田区大手町2-6-2　JOB HUB SQUARE,1988年4月14日,登録なし,登録なし,平成12年8月1日,http://www.pasona-global.com,営業 / 企画・経営 / 管理・事務 / コンサルタント・金融・不動産専門職 / クリエイティブ / WEB・インターネット・ゲーム / ITエンジニア / 電気・電子・機械・半導体 / 建築・土木 / 医薬・食品・化学・素材,【国内】 関東 / 関西 【海外】 その他アジア / 中国 / 香港 / シンガポール / メキシコ・ブラジル / ヨーロッパ / その他海外
株式会社パソナヒューマンソリューションズ,〒105-0001 東京都港区虎ノ門1-16-16 虎ノ門１丁目ＭＧビルディング　６Ｆ／７Ｆ,昭和60年4月26日,4名,登録なし,平成9年11月,https://www.pasona-hs.co.jp,ITエンジニア / 営業 / 企画・経営 / 管理・事務 / WEB・インターネット・ゲーム / 建築・土木 / 技能工・設備・倉庫・農林水産・他,関東 / 北海道・東北 / 北信越 / 関西 / 東海 / 中国・四国 / 九州
株式会社パック・エックス,〒105-0021 東京都港区東新橋2-4-1　サンマリーノ汐留6Ｆ,1994年2月,登録なし,登録なし,2014年10月,https://www.pac-ex.com/,営業 / 企画・経営 / 管理・事務 / 販売・フード・アミューズメント / コンサルタント・金融・不動産専門職 / クリエイティブ / WEB・インターネット・ゲーム,北海道・東北 / 北信越 / 関東 / 関西 / 東海 / 中国・四国 / 九州
パナキャリア株式会社,〒273-0101 千葉県鎌ケ谷市富岡3-4-21,2014年11月,登録なし,登録なし,2015年2月,http://www.panacareer.jp,建築・土木 / 販売・フード・アミューズメント / 医薬・食品・化学・素材,北海道・東北 / 北信越 / 関東 / 関西 / 東海 / 中国・四国 / 九州
株式会社パレッツ,〒810-0001 福岡県福岡市中央区天神3丁目3番5号　天神大産ビル3Ｆ,平成14年10月1日,登録なし,登録なし,平成18年1月1日,http://www.pallets.co.jp,ITエンジニア / 営業,九州
パーソルテンプスタッフ株式会社（キャリアプロモーションセンター）,〒100-0005 東京都渋谷区代々木2-1-1新宿マインズタワー,1973年(昭和48年)　5月,10名,登録なし,1999年,http://www.tempstaff.co.jp/,管理・事務 / 企画・経営,関東
パーソルテンプスタッフ株式会社,〒151-0053 東京都渋谷区東京都渋谷区代々木2-1-1 新宿マインズタワー,1973年(昭和48年)　5月,登録なし,登録なし,1999年,http://www.tempstaff.co.jp/,管理・事務 / 営業 / 企画・経営,関東
【京都エリアに特化した転職エージェント】　株式会社ヒトコト,〒604-8153 京都府京都市中京区烏丸通四条上ル笋町 688　第15長谷ビル5F,2006年6月30日,4名,登録なし,2007年,http://www.kotonokoto.jp/,電気・電子・機械・半導体 / 営業 / 企画・経営 / 管理・事務 / クリエイティブ / WEB・インターネット・ゲーム / ITエンジニア,関西
株式会社ヒューネル,〒169-0074 東京都新宿区北新宿1-5-2佐藤ビル3F,2006年9月,登録なし,登録なし,2013年,https://www.hunel.co.jp/,営業 / 企画・経営 / 管理・事務 / 販売・フード・アミューズメント,関東
株式会社ヒュープロ,〒211-0065 神奈川県川崎市中原区今井仲町,2015年11月19日,登録なし,登録なし,2016年,http://hupro.jp/samuraicareer/,管理・事務 / 企画・経営,関東 / 関西 / 九州
株式会社ヒューマリッジ,〒101-0051 東京都千代田区神田神保町2-23-4,2015年11月,3名,登録なし,平成29年1月,http://www.huemaridge.co.jp,営業 / 企画・経営 / 管理・事務 / 販売・フード・アミューズメント / 保育・教育・通訳 / コンサルタント・金融・不動産専門職 / クリエイティブ / WEB・インターネット・ゲーム,関東 / 北海道・東北 / 北信越 / 関西 / 東海 / 中国・四国 / 九州
株式会社ヒューマン・アセット・マネジメント,〒113-0033 東京都文京区本郷2-40-13　本郷コーポレイション1002号室,2016年4月,登録なし,登録なし,2016年8月,登録なし,管理・事務 / 営業 / 電気・電子・機械・半導体 / 医薬・食品・化学・素材,関東
株式会社ヒューマン・インベントリー,〒101-0052 東京都千代田区神田小川町1-1 神田室町ビル４階,平成13年10月1日（合併）,登録なし,登録なし,平成9年7月1日,http://www.human-in.co.jp/,営業 / 企画・経営 / 管理・事務 / 販売・フード・アミューズメント,関東 / 関西
株式会社ヒューマンスタイリング,〒107-0062 東京都港区南青山3-13-2　山川ビル3階,2010年9月,登録なし,登録なし,2016年4月,登録なし,営業 / 企画・経営 / 販売・フード・アミューズメント / 美容・ホテル・ブライダル・交通 / 医療・福祉 / ITエンジニア / 建築・土木 / 医薬・食品・化学・素材,北海道・東北 / 北信越 / 関東 / 関西 / 東海
ヒューマンステージ株式会社,〒541-0053 大阪府大阪市中央区本町3-2-6　本町ドリームビル,1987年1月,46名,登録なし,平成11年,http://www.human.or.jp/,企画・経営 / 営業 / 管理・事務 / ITエンジニア / 電気・電子・機械・半導体,関西 / 関東 / 東海
ヒューマンタッチ株式会社　東京本社,〒160-0023 東京都新宿区西新宿7-5-25　西新宿木村屋ビル1F,2012年4月,75名,登録なし,2012年8月,http://human-touch.jp/career/,建築・土木 / 電気・電子・機械・半導体,関東 / 北海道・東北 / 北信越 / 関西 / 東海 / 中国・四国 / 九州
ヒューマンタッチ株式会社　大阪支社,〒542-0081 大阪府大阪市中央区南船場4-4-21　 りそな船場ビル7階,平成24年8月1日,75名,登録なし,2012年8月,https://human-touch.jp/,電気・電子・機械・半導体 / 建築・土木,関西 / 北海道・東北 / 北信越 / 関東 / 東海 / 中国・四国 / 九州
株式会社ヒューマン・ハーバー,〒171-0022 東京都豊島区南池袋2-30-8　友泉南池袋ビル7F,1989年5月,2名,登録なし,2000年8月,http://www.human-harbor.co.jp/,コンサルタント・金融・不動産専門職 / 営業 / 企画・経営 / 管理・事務 / クリエイティブ / 建築・土木 / 技能工・設備・倉庫・農林水産・他,関東
ヒューマンリソシア株式会社,〒160-0023 東京都新宿区西新宿7-5-25 西新宿木村屋ビル 1Ｆ,1988年2月,登録なし,登録なし,1989年5月,https://resocia.jp/career/,営業 / 企画・経営 / 管理・事務,登録なし
株式会社ヒルストンキャリア,〒101-0045 東京都千代田区神田鍛冶町3-3-9 喜助新千代田ビル4F,2014年11月4日,14名,登録なし,2015年1月1日,http://www.hillstonecareer.com,管理・事務 / 営業 / 企画・経営 / 販売・フード・アミューズメント / 美容・ホテル・ブライダル・交通 / 医療・福祉 / 保育・教育・通訳 / コンサルタント・金融・不動産専門職 / クリエイティブ / WEB・インターネット・ゲーム / ITエンジニア / 電気・電子・機械・半導体 / 建築・土木 / 医薬・食品・化学・素材 / 技能工・設備・倉庫・農林水産・他 / 公共サービス,北海道・東北 / 北信越 / 関東 / 関西 / 東海 / 中国・四国 / 九州
ヒロテクノス株式会社,〒231-0002 神奈川県横浜市中区海岸通４−２０−２ YT馬車道ビル,2006年8月,3名,登録なし,2012年10月,http://www.hiro-ts.co.jp,電気・電子・機械・半導体 / 営業 / 企画・経営 / 管理・事務 / ITエンジニア / 医薬・食品・化学・素材 / 技能工・設備・倉庫・農林水産・他,関東 / 北海道・東北 / 北信越 / 九州
ビジネス・コンサート株式会社,〒577-0011 大阪府東大阪市荒本北1丁目4-17　クリエイション・コア東大阪 北館307,1987年10月1日,5名,登録なし,2001年,http://www.b-concert.co.jp/,技能工・設備・倉庫・農林水産・他 / 営業 / 管理・事務 / 電気・電子・機械・半導体,関西
株式会社ビッグツリーテクノロジー＆コンサルティング,〒106-0041 東京都港区麻布台2-3-5　ノアビル3階,2002年2月7日,4名,登録なし,2009年8月1日,http://www.bigtreetc.com/,ITエンジニア / WEB・インターネット・ゲーム,関東
株式会社VIVAインテリジェンスネットワーク,〒170-0013 東京都豊島区東池袋3-21-18 第一笠原ビル5F,2017年3月,4名,登録なし,2017年7月1日,http://viva-in.co.jp/,営業 / 企画・経営 / 管理・事務 / 販売・フード・アミューズメント / 美容・ホテル・ブライダル・交通 / 医療・福祉 / 保育・教育・通訳,関東 / 北海道・東北 / 関西
株式会社ＢＳコーポレーション,〒532-0011 大阪府大阪市淀川区西中島3-12-15　第５新大阪ビル６Ｆ  東京事務所 〒156-0043 東京都世田谷区松原5-26-1　グランパーク３F,２０００年４月,5名,登録なし,２０００年８月,http://www.bs-corp.co.jp,営業 / 企画・経営 / 管理・事務 / コンサルタント・金融・不動産専門職 / ITエンジニア / 電気・電子・機械・半導体 / 建築・土木 / 医薬・食品・化学・素材 / 公共サービス,【国内】 関東 / 関西 / 東海 【海外】 中国 / シンガポール / その他アジア / アメリカ・カナダ / ヨーロッパ
BT社しごとナビ株式会社,〒164-0001 東京都中野区中野4-1-1　中野サンプラザ9Ｆ,2016年,5名,登録なし,201+稔,http://www.brain-t.biz/shigotonavi,営業 / 企画・経営 / 販売・フード・アミューズメント / WEB・インターネット・ゲーム / ITエンジニア / 電気・電子・機械・半導体 / 建築・土木 / 技能工・設備・倉庫・農林水産・他,北海道・東北 / 関東 / 関西 / 東海 / 中国・四国
株式会社ビーリンク,〒651-0094 兵庫県神戸市中央区琴ノ緒町5-7-8,平成25年11月25日,登録なし,登録なし,平成25年3月1日,https://bl-group.co.jp,営業 / 管理・事務 / 販売・フード・アミューズメント / 美容・ホテル・ブライダル・交通 / WEB・インターネット・ゲーム,関西
PMC株式会社,〒170-0013 東京都豊島区東池袋1-31-13-203,1990年2月1日,5名,登録なし,2016年,登録なし,営業 / 企画・経営,登録なし
ピースアンドライト・キャリア株式会社,〒102-0072 東京都千代田区飯田橋1-7-10 山京ビル本館5階,平成29年4月5日,登録なし,登録なし,2017年,https://peace-light.jp/,営業 / 企画・経営 / 管理・事務,登録なし
株式会社PW Solutions,〒100-0004 東京都千代田区大手町1-1-3　大手センタービル17F,2016年8月,2名,登録なし,2017年2月,https://pwgroup.co.jp/,販売・フード・アミューズメント,登録なし
PTSコンサルティング・ジャパン株式会社,〒108-0075 東京都港区港南2-12-23　明産高浜ビル6階,1997年10月16日,5名,登録なし,２００８年１０月,www.ptsconsulting.co.jp,登録なし,登録なし
株式会社ファイブスターコンサルタント,〒162-0845 東京都新宿区市谷本村町3番18号エムズビル4階,2014年,5名,登録なし,2014年,http://5starcon.co.jp,建築・土木 / 営業 / 企画・経営 / 管理・事務 / 販売・フード・アミューズメント / コンサルタント・金融・不動産専門職 / クリエイティブ / ITエンジニア / 電気・電子・機械・半導体,北海道・東北 / 北信越 / 関東 / 関西 / 東海 / 中国・四国 / 九州
株式会社FastForward,〒151-0051 東京都渋谷区千駄ヶ谷5−21−8代々木第十下田ビル5階,2017/3/30,登録なし,登録なし,2017/6/30,http://fastforward.co.jp,営業 / 企画・経営 / 管理・事務 / 美容・ホテル・ブライダル・交通 / クリエイティブ / WEB・インターネット・ゲーム / ITエンジニア / 医薬・食品・化学・素材,【国内】 関東 【海外】 その他アジア
株式会社ファンオブライフ,〒150-0001 東京都渋谷区神宮前6-19-16 U-natura301　渋谷駅より徒歩7分,2015年 6月17日,3名,登録なし,2015年9月,https://education-career.jp/,保育・教育・通訳 / 営業 / 企画・経営 / コンサルタント・金融・不動産専門職 / WEB・インターネット・ゲーム,関東 / 北海道・東北 / 北信越 / 関西 / 東海 / 中国・四国 / 九州
株式会社フィデス,〒102-0074 東京都千代田区九段南2-2-1　エース九段ビル3階,2012年,3名,登録なし,2013年1月1日,https://www.mri-fides.com/,営業 / 管理・事務 / 販売・フード・アミューズメント / 美容・ホテル・ブライダル・交通 / 医療・福祉 / WEB・インターネット・ゲーム / ITエンジニア / 電気・電子・機械・半導体,関東 / 関西 / 東海
フィナンシャル・アドバイザーズ株式会社,〒102-0072 東京都千代田区飯田橋2-6-6　ヒューリック飯田橋ビル６Ｆ,2002年 4月1日,5名,登録なし,2005年,http://www.financial-a.com,登録なし,登録なし
株式会社For needs,〒132-0025 東京都江戸川区松江4-4-1,2006年4月,登録なし,登録なし,2010年10月,http://www.for-needs.co.jp/,営業 / 企画・経営 / 管理・事務 / コンサルタント・金融・不動産専門職 / クリエイティブ / WEB・インターネット・ゲーム / ITエンジニア,関東
株式会社富士誇,〒150-0034 東京都渋谷区代官山町14-15　HARAPPA代官山3F,2007年1月,31名,登録なし,2007年5月1日,http://www.fujico.co.jp/,ITエンジニア / 営業 / 企画・経営 / 管理・事務 / コンサルタント・金融・不動産専門職 / WEB・インターネット・ゲーム / 電気・電子・機械・半導体 / 建築・土木 / 技能工・設備・倉庫・農林水産・他,関東 / 北海道・東北 / 北信越 / 関西 / 東海 / 中国・四国 / 九州
富士ヒューマンテック株式会社,〒330-0074 埼玉県さいたま市浦和区北浦和4-5-5　 北浦和大栄ビル3F,2002年9月1日,9名,登録なし,平成14年9月6日,http://www.fujihumantec.com/,営業 / 管理・事務,登録なし
株式会社フレアエージェント,〒060-0061 北海道札幌市中央区南一条西5丁目7豊川南一条ビル5F,平成26年3月,登録なし,登録なし,平成26年,http://www.hurea.co.jp/,営業 / 医療・福祉 / 販売・フード・アミューズメント,登録なし
株式会社プロエクス,〒160-0022 東京都新宿区新宿２丁目４−１　第２２宮廷マンション９０３,2006年7月13日,1名,登録なし,2006年10月,http://www.proex.jp,登録なし,登録なし
株式会社フロンティア,〒460-0003 愛知県名古屋市中区錦3-10-14　協和錦ビル4F,2003年,登録なし,登録なし,2006年,http://frontier.sc,営業 / 企画・経営 / 管理・事務 / 販売・フード・アミューズメント / クリエイティブ / ITエンジニア / 建築・土木 / 技能工・設備・倉庫・農林水産・他,東海
株式会社ブライナ,〒330-0854 埼玉県さいたま市大宮区桜木町1-9-18 タナカビル5F,2002年,2名,登録なし,2005年,登録なし,電気・電子・機械・半導体 / 医薬・食品・化学・素材,登録なし
株式会社ブリッジ・ワークス,〒214-0037 神奈川県川崎市多摩区西生田3丁目16-19-1,2009年8月3日,3名,登録なし,2009年,http://bridge-worx.com/,クリエイティブ / WEB・インターネット・ゲーム,関東
株式会社ブレーンパワー,〒530-0011 大阪府大阪市北区大深町3番1号　グランフロント大阪　ナレッジキャピタルタワーC11階,昭和61年6月,5名,登録なし,平成12年11月,www.brain-power.co.jp,電気・電子・機械・半導体 / 営業 / 企画・経営 / 管理・事務 / クリエイティブ / WEB・インターネット・ゲーム / ITエンジニア / 建築・土木 / 医薬・食品・化学・素材 / 技能工・設備・倉庫・農林水産・他,【国内】 関東 / 関西 【海外】 シンガポール / その他アジア
株式会社プラットイン,〒541-0053 大阪府大阪市中央区本町4-7-4本町グラマシー3F,2016年9月13日,2名,登録なし,2017年,http://www.platin.co.jp/,管理・事務 / 営業 / 販売・フード・アミューズメント / ITエンジニア / 建築・土木 / 医薬・食品・化学・素材,関西
株式会社プルミエール,〒101-0045 東京都千代田区神田鍛冶町3-3-9　共同ビル（新千代田）4階,2004年,登録なし,登録なし,2004年,http://www.prem-biz.com/index.htm,登録なし,登録なし
株式会社 プレコ,〒730-0044 広島県広島市中区宝町4-28大興ビル6F,平成9年7月1日,3名,登録なし,平成１４年,http://www.pureco.co.jp,管理・事務 / 電気・電子・機械・半導体,中国・四国
有限会社プレジール（アーク・キャリア）,〒273-0102 千葉県鎌ケ谷市右京塚9-27,2016年11月1日,登録なし,登録なし,2016年11月1日,登録なし,医療・福祉,登録なし
株式会社プレンティー東京本社,〒105-0013 東京都港区浜松町2-7-8　加藤ビル2階,2010年3月,3名,登録なし,2010年,http://www.plenty-tokyo.com/,美容・ホテル・ブライダル・交通 / 販売・フード・アミューズメント,関東
プレースメント株式会社,〒550-0002 大阪府大阪市西区江戸堀1-6-13　肥後橋堀田ビル2F,2001年4月,2名,登録なし,2010年4月1日,http://www.placement.co.jp,営業 / 管理・事務 / 電気・電子・機械・半導体 / 建築・土木,関西
株式会社プロフィールド,〒450-0002 愛知県名古屋市中村区名駅4-24-8　EME名古屋ビル2F,平成12年1月,14名,登録なし,15,http://www.profield.info/,クリエイティブ / WEB・インターネット・ゲーム / ITエンジニア / 電気・電子・機械・半導体 / 建築・土木 / 医薬・食品・化学・素材 / 技能工・設備・倉庫・農林水産・他,【国内】 北海道・東北 / 北信越 / 関西 / 東海 / 中国・四国 / 九州 【海外】 その他海外
株式会社ベストスタッフ,〒410-0822 静岡県沼津市下香貫藤井原1672-3　ハイツさんさん101,2012年8月1日,登録なし,登録なし,2012年11月,登録なし,営業 / 管理・事務 / 販売・フード・アミューズメント,東海 / 関東
株式会社ベルキャリエール,〒420-0859 静岡県静岡市葵区栄町１－３　鈴与静岡ビル５Ｆ,1980年4月10日,10名,登録なし,2001年3月,http://www.bellenet.co.jp/,管理・事務 / 営業 / 企画・経営 / 医療・福祉 / 保育・教育・通訳 / WEB・インターネット・ゲーム / ITエンジニア / 建築・土木,東海 / 関東 / 関西 / 九州
